{
  "schema_version": "1.0.0",
  "canary_id": "cnry_01J6G7R8Q9ABCDEFGHJKMNPQ60",
  "experiment_id": "exp_01J6G7R8Q9ABCDEFGHJKMNPQ20",
  "correlation_id": "corr_01J6G7R8Q9ABCDEFGHJKMNPQ02",
  "baseline_policy_version": "pol_01J6G7R8Q9ABCDEFGHJKMNPQ10",
  "candidate_policy_version": "pol_01J6G7R8Q9ABCDEFGHJKMNPQ40",
  "canary_task_ids": [
    "TASK-002"
  ],
  "baseline_run_keys": [
    "run_01a2b3c4d5e6f789"
  ],
  "candidate_run_keys": [
    "run_02b3c4d5e6f78901"
  ],
  "candidate_passed": true,
  "guardrails_evaluated": [
    "LATENCY_P95_CEILING",
    "AST_SYNTAX_PRESERVATION",
    "SECRET_LEAKAGE_PREVENTION"
  ],
  "guardrails_breached": [],
  "promotion_approved": true,
  "rollback_triggered": false,
  "rollback_reason": "None",
  "evaluated_at": "2026-08-29T10:00:44.000Z",
  "created_at": "2026-08-29T10:00:44.000Z"
}
